{
  "charset": "Windows-1251",
  "description": "Mapping table from https://www.unicode.org/Public/MAPPINGS/VENDORS/MICSFT/WINDOWS/CP1251.TXT",
  "aliases": [
    "CP1251",
    "MS1251",
    "WIN1251"
  ],
  "min_bytes": 1,
  "max_bytes": 1,
  "is_variable_width": false,
  "unmapped_policy": "reject",
  "mappings": [
    {
      "byte_sequence": "0x00",
      "unicode_codepoint": "U+0000"
    },
    {
      "byte_sequence": "0x01",
      "unicode_codepoint": "U+0001"
    },
    {
      "byte_sequence": "0x02",
      "unicode_codepoint": "U+0002"
    },
    {
      "byte_sequence": "0x03",
      "unicode_codepoint": "U+0003"
    },
    {
      "byte_sequence": "0x04",
      "unicode_codepoint": "U+0004"
    },
    {
      "byte_sequence": "0x05",
      "unicode_codepoint": "U+0005"
    },
    {
      "byte_sequence": "0x06",
      "unicode_codepoint": "U+0006"
    },
    {
      "byte_sequence": "0x07",
      "unicode_codepoint": "U+0007"
    },
    {
      "byte_sequence": "0x08",
      "unicode_codepoint": "U+0008"
    },
    {
      "byte_sequence": "0x09",
      "unicode_codepoint": "U+0009"
    },
    {
      "byte_sequence": "0x0A",
      "unicode_codepoint": "U+000A"
    },
    {
      "byte_sequence": "0x0B",
      "unicode_codepoint": "U+000B"
    },
    {
      "byte_sequence": "0x0C",
      "unicode_codepoint": "U+000C"
    },
    {
      "byte_sequence": "0x0D",
      "unicode_codepoint": "U+000D"
    },
    {
      "byte_sequence": "0x0E",
      "unicode_codepoint": "U+000E"
    },
    {
      "byte_sequence": "0x0F",
      "unicode_codepoint": "U+000F"
    },
    {
      "byte_sequence": "0x10",
      "unicode_codepoint": "U+0010"
    },
    {
      "byte_sequence": "0x11",
      "unicode_codepoint": "U+0011"
    },
    {
      "byte_sequence": "0x12",
      "unicode_codepoint": "U+0012"
    },
    {
      "byte_sequence": "0x13",
      "unicode_codepoint": "U+0013"
    },
    {
      "byte_sequence": "0x14",
      "unicode_codepoint": "U+0014"
    },
    {
      "byte_sequence": "0x15",
      "unicode_codepoint": "U+0015"
    },
    {
      "byte_sequence": "0x16",
      "unicode_codepoint": "U+0016"
    },
    {
      "byte_sequence": "0x17",
      "unicode_codepoint": "U+0017"
    },
    {
      "byte_sequence": "0x18",
      "unicode_codepoint": "U+0018"
    },
    {
      "byte_sequence": "0x19",
      "unicode_codepoint": "U+0019"
    },
    {
      "byte_sequence": "0x1A",
      "unicode_codepoint": "U+001A"
    },
    {
      "byte_sequence": "0x1B",
      "unicode_codepoint": "U+001B"
    },
    {
      "byte_sequence": "0x1C",
      "unicode_codepoint": "U+001C"
    },
    {
      "byte_sequence": "0x1D",
      "unicode_codepoint": "U+001D"
    },
    {
      "byte_sequence": "0x1E",
      "unicode_codepoint": "U+001E"
    },
    {
      "byte_sequence": "0x1F",
      "unicode_codepoint": "U+001F"
    },
    {
      "byte_sequence": "0x20",
      "unicode_codepoint": "U+0020"
    },
    {
      "byte_sequence": "0x21",
      "unicode_codepoint": "U+0021"
    },
    {
      "byte_sequence": "0x22",
      "unicode_codepoint": "U+0022"
    },
    {
      "byte_sequence": "0x23",
      "unicode_codepoint": "U+0023"
    },
    {
      "byte_sequence": "0x24",
      "unicode_codepoint": "U+0024"
    },
    {
      "byte_sequence": "0x25",
      "unicode_codepoint": "U+0025"
    },
    {
      "byte_sequence": "0x26",
      "unicode_codepoint": "U+0026"
    },
    {
      "byte_sequence": "0x27",
      "unicode_codepoint": "U+0027"
    },
    {
      "byte_sequence": "0x28",
      "unicode_codepoint": "U+0028"
    },
    {
      "byte_sequence": "0x29",
      "unicode_codepoint": "U+0029"
    },
    {
      "byte_sequence": "0x2A",
      "unicode_codepoint": "U+002A"
    },
    {
      "byte_sequence": "0x2B",
      "unicode_codepoint": "U+002B"
    },
    {
      "byte_sequence": "0x2C",
      "unicode_codepoint": "U+002C"
    },
    {
      "byte_sequence": "0x2D",
      "unicode_codepoint": "U+002D"
    },
    {
      "byte_sequence": "0x2E",
      "unicode_codepoint": "U+002E"
    },
    {
      "byte_sequence": "0x2F",
      "unicode_codepoint": "U+002F"
    },
    {
      "byte_sequence": "0x30",
      "unicode_codepoint": "U+0030"
    },
    {
      "byte_sequence": "0x31",
      "unicode_codepoint": "U+0031"
    },
    {
      "byte_sequence": "0x32",
      "unicode_codepoint": "U+0032"
    },
    {
      "byte_sequence": "0x33",
      "unicode_codepoint": "U+0033"
    },
    {
      "byte_sequence": "0x34",
      "unicode_codepoint": "U+0034"
    },
    {
      "byte_sequence": "0x35",
      "unicode_codepoint": "U+0035"
    },
    {
      "byte_sequence": "0x36",
      "unicode_codepoint": "U+0036"
    },
    {
      "byte_sequence": "0x37",
      "unicode_codepoint": "U+0037"
    },
    {
      "byte_sequence": "0x38",
      "unicode_codepoint": "U+0038"
    },
    {
      "byte_sequence": "0x39",
      "unicode_codepoint": "U+0039"
    },
    {
      "byte_sequence": "0x3A",
      "unicode_codepoint": "U+003A"
    },
    {
      "byte_sequence": "0x3B",
      "unicode_codepoint": "U+003B"
    },
    {
      "byte_sequence": "0x3C",
      "unicode_codepoint": "U+003C"
    },
    {
      "byte_sequence": "0x3D",
      "unicode_codepoint": "U+003D"
    },
    {
      "byte_sequence": "0x3E",
      "unicode_codepoint": "U+003E"
    },
    {
      "byte_sequence": "0x3F",
      "unicode_codepoint": "U+003F"
    },
    {
      "byte_sequence": "0x40",
      "unicode_codepoint": "U+0040"
    },
    {
      "byte_sequence": "0x41",
      "unicode_codepoint": "U+0041"
    },
    {
      "byte_sequence": "0x42",
      "unicode_codepoint": "U+0042"
    },
    {
      "byte_sequence": "0x43",
      "unicode_codepoint": "U+0043"
    },
    {
      "byte_sequence": "0x44",
      "unicode_codepoint": "U+0044"
    },
    {
      "byte_sequence": "0x45",
      "unicode_codepoint": "U+0045"
    },
    {
      "byte_sequence": "0x46",
      "unicode_codepoint": "U+0046"
    },
    {
      "byte_sequence": "0x47",
      "unicode_codepoint": "U+0047"
    },
    {
      "byte_sequence": "0x48",
      "unicode_codepoint": "U+0048"
    },
    {
      "byte_sequence": "0x49",
      "unicode_codepoint": "U+0049"
    },
    {
      "byte_sequence": "0x4A",
      "unicode_codepoint": "U+004A"
    },
    {
      "byte_sequence": "0x4B",
      "unicode_codepoint": "U+004B"
    },
    {
      "byte_sequence": "0x4C",
      "unicode_codepoint": "U+004C"
    },
    {
      "byte_sequence": "0x4D",
      "unicode_codepoint": "U+004D"
    },
    {
      "byte_sequence": "0x4E",
      "unicode_codepoint": "U+004E"
    },
    {
      "byte_sequence": "0x4F",
      "unicode_codepoint": "U+004F"
    },
    {
      "byte_sequence": "0x50",
      "unicode_codepoint": "U+0050"
    },
    {
      "byte_sequence": "0x51",
      "unicode_codepoint": "U+0051"
    },
    {
      "byte_sequence": "0x52",
      "unicode_codepoint": "U+0052"
    },
    {
      "byte_sequence": "0x53",
      "unicode_codepoint": "U+0053"
    },
    {
      "byte_sequence": "0x54",
      "unicode_codepoint": "U+0054"
    },
    {
      "byte_sequence": "0x55",
      "unicode_codepoint": "U+0055"
    },
    {
      "byte_sequence": "0x56",
      "unicode_codepoint": "U+0056"
    },
    {
      "byte_sequence": "0x57",
      "unicode_codepoint": "U+0057"
    },
    {
      "byte_sequence": "0x58",
      "unicode_codepoint": "U+0058"
    },
    {
      "byte_sequence": "0x59",
      "unicode_codepoint": "U+0059"
    },
    {
      "byte_sequence": "0x5A",
      "unicode_codepoint": "U+005A"
    },
    {
      "byte_sequence": "0x5B",
      "unicode_codepoint": "U+005B"
    },
    {
      "byte_sequence": "0x5C",
      "unicode_codepoint": "U+005C"
    },
    {
      "byte_sequence": "0x5D",
      "unicode_codepoint": "U+005D"
    },
    {
      "byte_sequence": "0x5E",
      "unicode_codepoint": "U+005E"
    },
    {
      "byte_sequence": "0x5F",
      "unicode_codepoint": "U+005F"
    },
    {
      "byte_sequence": "0x60",
      "unicode_codepoint": "U+0060"
    },
    {
      "byte_sequence": "0x61",
      "unicode_codepoint": "U+0061"
    },
    {
      "byte_sequence": "0x62",
      "unicode_codepoint": "U+0062"
    },
    {
      "byte_sequence": "0x63",
      "unicode_codepoint": "U+0063"
    },
    {
      "byte_sequence": "0x64",
      "unicode_codepoint": "U+0064"
    },
    {
      "byte_sequence": "0x65",
      "unicode_codepoint": "U+0065"
    },
    {
      "byte_sequence": "0x66",
      "unicode_codepoint": "U+0066"
    },
    {
      "byte_sequence": "0x67",
      "unicode_codepoint": "U+0067"
    },
    {
      "byte_sequence": "0x68",
      "unicode_codepoint": "U+0068"
    },
    {
      "byte_sequence": "0x69",
      "unicode_codepoint": "U+0069"
    },
    {
      "byte_sequence": "0x6A",
      "unicode_codepoint": "U+006A"
    },
    {
      "byte_sequence": "0x6B",
      "unicode_codepoint": "U+006B"
    },
    {
      "byte_sequence": "0x6C",
      "unicode_codepoint": "U+006C"
    },
    {
      "byte_sequence": "0x6D",
      "unicode_codepoint": "U+006D"
    },
    {
      "byte_sequence": "0x6E",
      "unicode_codepoint": "U+006E"
    },
    {
      "byte_sequence": "0x6F",
      "unicode_codepoint": "U+006F"
    },
    {
      "byte_sequence": "0x70",
      "unicode_codepoint": "U+0070"
    },
    {
      "byte_sequence": "0x71",
      "unicode_codepoint": "U+0071"
    },
    {
      "byte_sequence": "0x72",
      "unicode_codepoint": "U+0072"
    },
    {
      "byte_sequence": "0x73",
      "unicode_codepoint": "U+0073"
    },
    {
      "byte_sequence": "0x74",
      "unicode_codepoint": "U+0074"
    },
    {
      "byte_sequence": "0x75",
      "unicode_codepoint": "U+0075"
    },
    {
      "byte_sequence": "0x76",
      "unicode_codepoint": "U+0076"
    },
    {
      "byte_sequence": "0x77",
      "unicode_codepoint": "U+0077"
    },
    {
      "byte_sequence": "0x78",
      "unicode_codepoint": "U+0078"
    },